{
    "description": "simple model with linear_terms",
    "id": 0,
    "linear_terms": [
        {
            "coeff": 1.3,
            "id": 2
        },
        {
            "coeff": -0.7,
            "id": 6
        }
    ],
    "metadata": {},
    "offset": 0.0,
    "quadratic_terms": [],
    "scale": 1.0,
    "variable_domain": "boolean",
    "variable_ids": [
        2,
        4,
        6
    ],
    "version": "1.0.0"
}